{
  "$schema": "https://json-schema.org/draft/2020-12/schema",
  "$id": "https://aegisais.dev/contracts/Alert.schema.json",
  "title": "Alert",
  "type": "object",
  "additionalProperties": false,
  "required": [
    "id",
    "alertType",
    "status",
    "createdAt",
    "priority",
    "message",
    "confidence",
    "provenance",
    "access"
  ],
  "properties": {
    "id": { "type": "string" },
    "alertType": { "type": "string" },
    "eventId": { "type": "string" },
    "status": {
      "type": "string",
      "enum": ["new", "triaged", "acknowledged", "resolved", "closed"]
    },
    "priority": {
      "type": "string",
      "enum": ["p4", "p3", "p2", "p1"]
    },
    "message": { "type": "string" },
    "assignee": { "type": "string" },
    "createdAt": { "type": "string", "format": "date-time" },
    "acknowledgedAt": { "type": "string", "format": "date-time" },
    "resolvedAt": { "type": "string", "format": "date-time" },
    "confidence": { "$ref": "./Confidence.schema.json" },
    "provenance": { "$ref": "./Provenance.schema.json" },
    "access": { "$ref": "_common.json#/$defs/AccessMetadata" }
  }
}
